{
  "id": "nation-qawm-yunus",
  "title": "قوم يونس",
  "body": "## التعريف\nقوم يونس (يُعرف أيضاً: قوم يونس، أهل نينوى).\nقوم يونس كذّبوا ثم آمنوا قبل نزول العذاب، فكشف الله عنهم عذاب الخزي في الحياة الدنيا ومتعهم إلى حين. وهي حالة استثنائية نصّ عليها القرآن للعبرة، دون تعيين المدينة من الإسرائيليات.\nالنبي المرسل: يونس عليه السلام (prophet-yunus).\n\n## سياق الذكر في القرآن\nالمكان كما في العرض المعتمد: غير محدد بدقة في نص صحيح — وشاع في الأخبار نينوى.\nالحقبة/الترتيب النسبي: زمن يونس عليه السلام.\nذُكروا في القرآن للعبرة وتحذير الأمم، لا للاستكثار من الغرائب التي لم يثبتها الوحي.\n\n## الذنب والموقف\nالذنب أو سبب العقوبة: التكذيب أولاً؛ ثم تداركوا بالإيمان قبل حلول العذاب.\nموقفهم من الدعوة: آمنوا بعد خروج نبيهم فكشف الله عنهم عذاب الخزي في الدنيا.\nأبرز أحوالهم:\n- كذّبوا نبيهم أولاً\n- آمنوا قبل نزول العذاب فكُشف عنهم\n- استثناء ظاهر في سنن المكذّبين\n\n## الآيات الواردة\nطائفة من الآيات المرتبطة بـقوم يونس من المصحف المحلي (رسم عثماني):\n\n﴿فَلَوْلَا كَانَتْ قَرْيَةٌ ءَامَنَتْ فَنَفَعَهَآ إِيمَٰنُهَآ إِلَّا قَوْمَ يُونُسَ لَمَّآ ءَامَنُوا۟ كَشَفْنَا عَنْهُمْ عَذَابَ ٱلْخِزْىِ فِى ٱلْحَيَوٰةِ ٱلدُّنْيَا وَمَتَّعْنَٰهُمْ إِلَىٰ حِينٍۢ﴾ [10:98]\n\n﴿وَإِنَّ يُونُسَ لَمِنَ ٱلْمُرْسَلِينَ﴾ [37:139]\n\n﴿إِذْ أَبَقَ إِلَى ٱلْفُلْكِ ٱلْمَشْحُونِ﴾ [37:140]\n\n﴿فَسَاهَمَ فَكَانَ مِنَ ٱلْمُدْحَضِينَ﴾ [37:141]\n\n﴿فَٱلْتَقَمَهُ ٱلْحُوتُ وَهُوَ مُلِيمٌۭ﴾ [37:142]\n\n﴿فَلَوْلَآ أَنَّهُۥ كَانَ مِنَ ٱلْمُسَبِّحِينَ﴾ [37:143]\n\n﴿لَلَبِثَ فِى بَطْنِهِۦٓ إِلَىٰ يَوْمِ يُبْعَثُونَ﴾ [37:144]\n\n﴿۞ فَنَبَذْنَٰهُ بِٱلْعَرَآءِ وَهُوَ سَقِيمٌۭ﴾ [37:145]\n\n﴿وَأَنۢبَتْنَا عَلَيْهِ شَجَرَةًۭ مِّن يَقْطِينٍۢ﴾ [37:146]\n\n﴿وَأَرْسَلْنَٰهُ إِلَىٰ مِا۟ئَةِ أَلْفٍ أَوْ يَزِيدُونَ﴾ [37:147]\n\n﴿فَـَٔامَنُوا۟ فَمَتَّعْنَٰهُمْ إِلَىٰ حِينٍۢ﴾ [37:148]\n\n﴿وَذَا ٱلنُّونِ إِذ ذَّهَبَ مُغَٰضِبًۭا فَظَنَّ أَن لَّن نَّقْدِرَ عَلَيْهِ فَنَادَىٰ فِى ٱلظُّلُمَٰتِ أَن لَّآ إِلَٰهَ إِلَّآ أَنتَ سُبْحَٰنَكَ إِنِّى كُنتُ مِنَ ٱلظَّٰلِمِينَ﴾ [21:87]\n\n﴿فَٱسْتَجَبْنَا لَهُۥ وَنَجَّيْنَٰهُ مِنَ ٱلْغَمِّ ۚ وَكَذَٰلِكَ نُۨجِى ٱلْمُؤْمِنِينَ﴾ [21:88]\n\n## المآل والعبرة\nالعقوبة: النجاة والإيمان — آمنوا فكشف عنهم عذاب الخزي في الحياة الدنيا؛ ومتعة إلى حين.\nالناجون: القوم بعد إيمانهم؛ وقصة يونس في بطن الحوت سياق مستقل.\nالعبر:\n1) باب التوبة مفتوح قبل وقوع العذاب.\n2) الإيمان الجماعي الصادق يرفع البلاء بإذن الله.\n3) لا يُقاس كل قوم على قوم يونس في تأجيل العذاب.\n\nماذا نتعلم اليوم؟\n- بادر بالتوبة قبل أن يُغلق باب النفع.\n- لا تغتر بتأخير العقوبة؛ قوم يونس حالة منصوصة لا قاعدة عامة لكل مكذّب.\n\n## سياسة الإسرائيليات\nما خالف الشرع يُحذف. وما سُكت عنه إن ذُكر يُعلَّم أنه مسكوت عنه. ولا تُبنى عقيدة على خبر لم يثبت من كتاب أو سنة صحيحة.\n\n## خاتمة منهجية\nقراءة خبر «قوم يونس» طريق إلى تعظيم التوحيد والحذر من الاستكبار، لا إلى الاستكثار من الغرائب.\n\n## تثبيت منهجي\nيُقتصر على ما دلّ عليه القرآن وصحيح السنة وما حرّره أهل التفسير المعتمدون، مع اجتناب الإسرائيليات المخالفة. وما سكت عنه الوحي لا يُجزم بتفصيله.\n\n## عبرة للمكلّف\nالعبرة من قصص الأمم: التوحيد، والتحذير من التكذيب، والصبر على الحق، لا الاستكثار من الغرائب.\n\n## شواهد من القرآن\n\n- **10:98**: فَلَوْلَا كَانَتْ قَرْيَةٌ ءَامَنَتْ فَنَفَعَهَآ إِيمَٰنُهَآ إِلَّا قَوْمَ يُونُسَ لَمَّآ ءَامَنُوا۟ كَشَفْنَا عَنْهُمْ عَذَابَ ٱلْخِزْىِ فِى ٱلْحَيَوٰةِ ٱلدُّنْيَا وَمَتَّعْنَٰهُمْ إِلَىٰ حِينٍۢ\n- **37:139**: وَإِنَّ يُونُسَ لَمِنَ ٱلْمُرْسَلِينَ\n- **37:140**: إِذْ أَبَقَ إِلَى ٱلْفُلْكِ ٱلْمَشْحُونِ\n- **37:141**: فَسَاهَمَ فَكَانَ مِنَ ٱلْمُدْحَضِينَ\n- **37:142**: فَٱلْتَقَمَهُ ٱلْحُوتُ وَهُوَ مُلِيمٌۭ\n- **37:143**: فَلَوْلَآ أَنَّهُۥ كَانَ مِنَ ٱلْمُسَبِّحِينَ\n- **37:144**: لَلَبِثَ فِى بَطْنِهِۦٓ إِلَىٰ يَوْمِ يُبْعَثُونَ\n- **37:145**: ۞ فَنَبَذْنَٰهُ بِٱلْعَرَآءِ وَهُوَ سَقِيمٌۭ\n",
  "evidences": [
    {
      "type": "ayah",
      "ref": "10:98",
      "text": "فَلَوْلَا كَانَتْ قَرْيَةٌ ءَامَنَتْ فَنَفَعَهَآ إِيمَٰنُهَآ إِلَّا قَوْمَ يُونُسَ لَمَّآ ءَامَنُوا۟ كَشَفْنَا عَنْهُمْ عَذَابَ ٱلْخِزْىِ فِى ٱلْحَيَوٰةِ ٱلدُّنْيَا وَمَتَّعْنَٰهُمْ إِلَىٰ حِينٍۢ",
      "grade": "",
      "graded_by": ""
    },
    {
      "type": "ayah",
      "ref": "37:139",
      "text": "وَإِنَّ يُونُسَ لَمِنَ ٱلْمُرْسَلِينَ",
      "grade": "",
      "graded_by": ""
    },
    {
      "type": "ayah",
      "ref": "37:140",
      "text": "إِذْ أَبَقَ إِلَى ٱلْفُلْكِ ٱلْمَشْحُونِ",
      "grade": "",
      "graded_by": ""
    },
    {
      "type": "ayah",
      "ref": "37:141",
      "text": "فَسَاهَمَ فَكَانَ مِنَ ٱلْمُدْحَضِينَ",
      "grade": "",
      "graded_by": ""
    },
    {
      "type": "ayah",
      "ref": "37:142",
      "text": "فَٱلْتَقَمَهُ ٱلْحُوتُ وَهُوَ مُلِيمٌۭ",
      "grade": "",
      "graded_by": ""
    },
    {
      "type": "ayah",
      "ref": "37:143",
      "text": "فَلَوْلَآ أَنَّهُۥ كَانَ مِنَ ٱلْمُسَبِّحِينَ",
      "grade": "",
      "graded_by": ""
    },
    {
      "type": "ayah",
      "ref": "37:144",
      "text": "لَلَبِثَ فِى بَطْنِهِۦٓ إِلَىٰ يَوْمِ يُبْعَثُونَ",
      "grade": "",
      "graded_by": ""
    },
    {
      "type": "ayah",
      "ref": "37:145",
      "text": "۞ فَنَبَذْنَٰهُ بِٱلْعَرَآءِ وَهُوَ سَقِيمٌۭ",
      "grade": "",
      "graded_by": ""
    },
    {
      "type": "ayah",
      "ref": "37:146",
      "text": "وَأَنۢبَتْنَا عَلَيْهِ شَجَرَةًۭ مِّن يَقْطِينٍۢ",
      "grade": "",
      "graded_by": ""
    },
    {
      "type": "ayah",
      "ref": "37:147",
      "text": "وَأَرْسَلْنَٰهُ إِلَىٰ مِا۟ئَةِ أَلْفٍ أَوْ يَزِيدُونَ",
      "grade": "",
      "graded_by": ""
    },
    {
      "type": "ayah",
      "ref": "37:148",
      "text": "فَـَٔامَنُوا۟ فَمَتَّعْنَٰهُمْ إِلَىٰ حِينٍۢ",
      "grade": "",
      "graded_by": ""
    },
    {
      "type": "ayah",
      "ref": "21:87",
      "text": "وَذَا ٱلنُّونِ إِذ ذَّهَبَ مُغَٰضِبًۭا فَظَنَّ أَن لَّن نَّقْدِرَ عَلَيْهِ فَنَادَىٰ فِى ٱلظُّلُمَٰتِ أَن لَّآ إِلَٰهَ إِلَّآ أَنتَ سُبْحَٰنَكَ إِنِّى كُنتُ مِنَ ٱلظَّٰلِمِينَ",
      "grade": "",
      "graded_by": ""
    },
    {
      "type": "ayah",
      "ref": "21:88",
      "text": "فَٱسْتَجَبْنَا لَهُۥ وَنَجَّيْنَٰهُ مِنَ ٱلْغَمِّ ۚ وَكَذَٰلِكَ نُۨجِى ٱلْمُؤْمِنِينَ",
      "grade": "",
      "graded_by": ""
    }
  ],
  "sources": [
    {
      "book": "القرآن الكريم برسم العثماني",
      "author": "مصحف المشروع المحلي",
      "locator": "public/data/quran"
    },
    {
      "book": "قصص الأنبياء",
      "author": "ابن كثير",
      "locator": "مختصر معتمد — دون إسرائيليات مخالفة"
    },
    {
      "book": "بذرة الأمم السابقة",
      "author": "سُنّة",
      "locator": "src/lib/nations-seed.ts"
    }
  ],
  "tags": [
    "أمم",
    "موسّع"
  ],
  "related": [
    "prophet-yunus",
    "nation-bani-israil"
  ],
  "review_status": "verified",
  "updated_at": "2026-09-02",
  "section": "nations"
}
