{
  "id": "prophet-yusuf",
  "title": "يوسف عليه السلام",
  "body": "## التعريف والنسب\nالصّدّيق، أوتي علم تعبير الرؤيا، وابتُلي بالحسد والسجن، ثم مكّنه الله فعفا عن إخوته.\nيُقتصر في النسب والأخبار الزائدة على ما ثبت في الكتاب والسنة الصحيحة، ويُجتنب الجزم بما اختلف فيه أو جاء من طريق الإسرائيليات المخالفة. منهج العرض هنا: سوقُ النص القرآني أولاً، ثم بيانٌ مختصر على فهم السلف، مع الإحالة إلى قصص الأنبياء لابن كثير وتفسير الطبري وابن كثير والبغوي والسعدي عند التوسع.\n\n## الزمان والمكان\nلم يحدّد القرآن لكثير من الأنبياء تواريخ عددية دقيقة بالميلاد؛ فيُذكر ترتيبهم النسبي كما يدلّ عليه السياق القرآني دون اختراع تواريخ. وما جاء من تحديد بلدان أو أعمار بطرق ضعيفة أو إسرائيلية يُصنَّف ولا يُجزم به.\n\n## الدعوة\nأصل دعوة الرسل جميعاً التوحيد وعبادة الله وحده، ونهي أقوامهم عن الشرك والمعاصي، كما دلّت عليه مواضع قصصهم في القرآن. فالرسالة واحدة في الأصل، والشرائع قد تختلف بأمر الله.\n\n## أبرز المواقف والآيات\n﴿إِذْ قَالَ يُوسُفُ لِأَبِيهِ يَٰٓأَبَتِ إِنِّى رَأَيْتُ أَحَدَ عَشَرَ كَوْكَبًۭا وَٱلشَّمْسَ وَٱلْقَمَرَ رَأَيْتُهُمْ لِى سَٰجِدِينَ﴾ [12:4]\n\n﴿قَالَ يَٰبُنَىَّ لَا تَقْصُصْ رُءْيَاكَ عَلَىٰٓ إِخْوَتِكَ فَيَكِيدُوا۟ لَكَ كَيْدًا ۖ إِنَّ ٱلشَّيْطَٰنَ لِلْإِنسَٰنِ عَدُوٌّۭ مُّبِينٌۭ﴾ [12:5]\n\n﴿وَكَذَٰلِكَ يَجْتَبِيكَ رَبُّكَ وَيُعَلِّمُكَ مِن تَأْوِيلِ ٱلْأَحَادِيثِ وَيُتِمُّ نِعْمَتَهُۥ عَلَيْكَ وَعَلَىٰٓ ءَالِ يَعْقُوبَ كَمَآ أَتَمَّهَا عَلَىٰٓ أَبَوَيْكَ مِن قَبْلُ إِبْرَٰهِيمَ وَإِسْحَٰقَ ۚ إِنَّ رَبَّكَ عَلِيمٌ حَكِيمٌۭ﴾ [12:6]\n\n﴿۞ لَّقَدْ كَانَ فِى يُوسُفَ وَإِخْوَتِهِۦٓ ءَايَٰتٌۭ لِّلسَّآئِلِينَ﴾ [12:7]\n\n﴿إِذْ قَالُوا۟ لَيُوسُفُ وَأَخُوهُ أَحَبُّ إِلَىٰٓ أَبِينَا مِنَّا وَنَحْنُ عُصْبَةٌ إِنَّ أَبَانَا لَفِى ضَلَٰلٍۢ مُّبِينٍ﴾ [12:8]\n\n﴿ٱقْتُلُوا۟ يُوسُفَ أَوِ ٱطْرَحُوهُ أَرْضًۭا يَخْلُ لَكُمْ وَجْهُ أَبِيكُمْ وَتَكُونُوا۟ مِنۢ بَعْدِهِۦ قَوْمًۭا صَٰلِحِينَ﴾ [12:9]\n\n﴿قَالَ قَآئِلٌۭ مِّنْهُمْ لَا تَقْتُلُوا۟ يُوسُفَ وَأَلْقُوهُ فِى غَيَٰبَتِ ٱلْجُبِّ يَلْتَقِطْهُ بَعْضُ ٱلسَّيَّارَةِ إِن كُنتُمْ فَٰعِلِينَ﴾ [12:10]\n\n﴿قَالُوا۟ يَٰٓأَبَانَا مَا لَكَ لَا تَأْمَ۫نَّا عَلَىٰ يُوسُفَ وَإِنَّا لَهُۥ لَنَٰصِحُونَ﴾ [12:11]\n\n﴿وَلَمَّا بَلَغَ أَشُدَّهُۥٓ ءَاتَيْنَٰهُ حُكْمًۭا وَعِلْمًۭا ۚ وَكَذَٰلِكَ نَجْزِى ٱلْمُحْسِنِينَ﴾ [12:22]\n\n﴿وَرَٰوَدَتْهُ ٱلَّتِى هُوَ فِى بَيْتِهَا عَن نَّفْسِهِۦ وَغَلَّقَتِ ٱلْأَبْوَٰبَ وَقَالَتْ هَيْتَ لَكَ ۚ قَالَ مَعَاذَ ٱللَّهِ ۖ إِنَّهُۥ رَبِّىٓ أَحْسَنَ مَثْوَاىَ ۖ إِنَّهُۥ لَا يُفْلِحُ ٱلظَّٰلِمُونَ﴾ [12:23]\n\n﴿وَلَقَدْ هَمَّتْ بِهِۦ ۖ وَهَمَّ بِهَا لَوْلَآ أَن رَّءَا بُرْهَٰنَ رَبِّهِۦ ۚ كَذَٰلِكَ لِنَصْرِفَ عَنْهُ ٱلسُّوٓءَ وَٱلْفَحْشَآءَ ۚ إِنَّهُۥ مِنْ عِبَادِنَا ٱلْمُخْلَصِينَ﴾ [12:24]\n\n﴿وَٱسْتَبَقَا ٱلْبَابَ وَقَدَّتْ قَمِيصَهُۥ مِن دُبُرٍۢ وَأَلْفَيَا سَيِّدَهَا لَدَا ٱلْبَابِ ۚ قَالَتْ مَا جَزَآءُ مَنْ أَرَادَ بِأَهْلِكَ سُوٓءًا إِلَّآ أَن يُسْجَنَ أَوْ عَذَابٌ أَلِيمٌۭ﴾ [12:25]\n\n﴿قَالَ هِىَ رَٰوَدَتْنِى عَن نَّفْسِى ۚ وَشَهِدَ شَاهِدٌۭ مِّنْ أَهْلِهَآ إِن كَانَ قَمِيصُهُۥ قُدَّ مِن قُبُلٍۢ فَصَدَقَتْ وَهُوَ مِنَ ٱلْكَٰذِبِينَ﴾ [12:26]\n\n﴿وَإِن كَانَ قَمِيصُهُۥ قُدَّ مِن دُبُرٍۢ فَكَذَبَتْ وَهُوَ مِنَ ٱلصَّٰدِقِينَ﴾ [12:27]\n\n﴿فَلَمَّا رَءَا قَمِيصَهُۥ قُدَّ مِن دُبُرٍۢ قَالَ إِنَّهُۥ مِن كَيْدِكُنَّ ۖ إِنَّ كَيْدَكُنَّ عَظِيمٌۭ﴾ [12:28]\n\n﴿يُوسُفُ أَعْرِضْ عَنْ هَٰذَا ۚ وَٱسْتَغْفِرِى لِذَنۢبِكِ ۖ إِنَّكِ كُنتِ مِنَ ٱلْخَاطِـِٔينَ﴾ [12:29]\n\n﴿وَقَالَ ٱلْمَلِكُ إِنِّىٓ أَرَىٰ سَبْعَ بَقَرَٰتٍۢ سِمَانٍۢ يَأْكُلُهُنَّ سَبْعٌ عِجَافٌۭ وَسَبْعَ سُنۢبُلَٰتٍ خُضْرٍۢ وَأُخَرَ يَابِسَٰتٍۢ ۖ يَٰٓأَيُّهَا ٱلْمَلَأُ أَفْتُونِى فِى رُءْيَٰىَ إِن كُنتُمْ لِلرُّءْيَا تَعْبُرُونَ﴾ [12:43]\n\n﴿قَالُوٓا۟ أَضْغَٰثُ أَحْلَٰمٍۢ ۖ وَمَا نَحْنُ بِتَأْوِيلِ ٱلْأَحْلَٰمِ بِعَٰلِمِينَ﴾ [12:44]\n\n﴿وَقَالَ ٱلَّذِى نَجَا مِنْهُمَا وَٱدَّكَرَ بَعْدَ أُمَّةٍ أَنَا۠ أُنَبِّئُكُم بِتَأْوِيلِهِۦ فَأَرْسِلُونِ﴾ [12:45]\n\n﴿يُوسُفُ أَيُّهَا ٱلصِّدِّيقُ أَفْتِنَا فِى سَبْعِ بَقَرَٰتٍۢ سِمَانٍۢ يَأْكُلُهُنَّ سَبْعٌ عِجَافٌۭ وَسَبْعِ سُنۢبُلَٰتٍ خُضْرٍۢ وَأُخَرَ يَابِسَٰتٍۢ لَّعَلِّىٓ أَرْجِعُ إِلَى ٱلنَّاسِ لَعَلَّهُمْ يَعْلَمُونَ﴾ [12:46]\n\n﴿قَالَ تَزْرَعُونَ سَبْعَ سِنِينَ دَأَبًۭا فَمَا حَصَدتُّمْ فَذَرُوهُ فِى سُنۢبُلِهِۦٓ إِلَّا قَلِيلًۭا مِّمَّا تَأْكُلُونَ﴾ [12:47]\n\n﴿ثُمَّ يَأْتِى مِنۢ بَعْدِ ذَٰلِكَ سَبْعٌۭ شِدَادٌۭ يَأْكُلْنَ مَا قَدَّمْتُمْ لَهُنَّ إِلَّا قَلِيلًۭا مِّمَّا تُحْصِنُونَ﴾ [12:48]\n\n﴿ثُمَّ يَأْتِى مِنۢ بَعْدِ ذَٰلِكَ عَامٌۭ فِيهِ يُغَاثُ ٱلنَّاسُ وَفِيهِ يَعْصِرُونَ﴾ [12:49]\n\n﴿وَقَالَ ٱلْمَلِكُ ٱئْتُونِى بِهِۦ ۖ فَلَمَّا جَآءَهُ ٱلرَّسُولُ قَالَ ٱرْجِعْ إِلَىٰ رَبِّكَ فَسْـَٔلْهُ مَا بَالُ ٱلنِّسْوَةِ ٱلَّٰتِى قَطَّعْنَ أَيْدِيَهُنَّ ۚ إِنَّ رَبِّى بِكَيْدِهِنَّ عَلِيمٌۭ﴾ [12:50]\n\n## الابتلاءات والمعجزات الثابتة\nما ثبت من آياتهم هو ما نصّ عليه القرآن أو صحّ من السنة؛ وما سواه إن ذُكر فبصيغة التوقف أو التصنيف لا الجزم. ولا تُروى المعجزات من القصص الواهية لإثارة العجب.\n\n## مآل قومه\nلم يرتبط في هذا المدخل بأمة مهلَكة مسمّاة، أو أن قومه داخلون في سياق أوسع يُفهم من مجموع الآيات.\n\n## الدروس والعبر\nالعفاف، والعفو عند المقدرة، وأن العاقبة للمتقين.\nومن الفقه أن تُقرأ القصة لتعظيم الله وتحقيق التوحيد والصبر، لا للجدل بما لا ينفع.\n\n## سياسة المجلس في الإسرائيليات\nما خالف الشرع يُحذف، وما سُكت عنه يُعرض —إن احتيج— معلَّماً بأنه مسكوت عنه، ولا يُبنى عليه اعتقاد.",
  "evidences": [
    {
      "type": "ayah",
      "ref": "12:4",
      "text": "إِذْ قَالَ يُوسُفُ لِأَبِيهِ يَٰٓأَبَتِ إِنِّى رَأَيْتُ أَحَدَ عَشَرَ كَوْكَبًۭا وَٱلشَّمْسَ وَٱلْقَمَرَ رَأَيْتُهُمْ لِى سَٰجِدِينَ",
      "grade": "",
      "graded_by": ""
    },
    {
      "type": "ayah",
      "ref": "12:5",
      "text": "قَالَ يَٰبُنَىَّ لَا تَقْصُصْ رُءْيَاكَ عَلَىٰٓ إِخْوَتِكَ فَيَكِيدُوا۟ لَكَ كَيْدًا ۖ إِنَّ ٱلشَّيْطَٰنَ لِلْإِنسَٰنِ عَدُوٌّۭ مُّبِينٌۭ",
      "grade": "",
      "graded_by": ""
    },
    {
      "type": "ayah",
      "ref": "12:6",
      "text": "وَكَذَٰلِكَ يَجْتَبِيكَ رَبُّكَ وَيُعَلِّمُكَ مِن تَأْوِيلِ ٱلْأَحَادِيثِ وَيُتِمُّ نِعْمَتَهُۥ عَلَيْكَ وَعَلَىٰٓ ءَالِ يَعْقُوبَ كَمَآ أَتَمَّهَا عَلَىٰٓ أَبَوَيْكَ مِن قَبْلُ إِبْرَٰهِيمَ وَإِسْحَٰقَ ۚ إِنَّ رَبَّكَ عَلِيمٌ حَكِيمٌۭ",
      "grade": "",
      "graded_by": ""
    },
    {
      "type": "ayah",
      "ref": "12:7",
      "text": "۞ لَّقَدْ كَانَ فِى يُوسُفَ وَإِخْوَتِهِۦٓ ءَايَٰتٌۭ لِّلسَّآئِلِينَ",
      "grade": "",
      "graded_by": ""
    },
    {
      "type": "ayah",
      "ref": "12:8",
      "text": "إِذْ قَالُوا۟ لَيُوسُفُ وَأَخُوهُ أَحَبُّ إِلَىٰٓ أَبِينَا مِنَّا وَنَحْنُ عُصْبَةٌ إِنَّ أَبَانَا لَفِى ضَلَٰلٍۢ مُّبِينٍ",
      "grade": "",
      "graded_by": ""
    },
    {
      "type": "ayah",
      "ref": "12:9",
      "text": "ٱقْتُلُوا۟ يُوسُفَ أَوِ ٱطْرَحُوهُ أَرْضًۭا يَخْلُ لَكُمْ وَجْهُ أَبِيكُمْ وَتَكُونُوا۟ مِنۢ بَعْدِهِۦ قَوْمًۭا صَٰلِحِينَ",
      "grade": "",
      "graded_by": ""
    },
    {
      "type": "ayah",
      "ref": "12:10",
      "text": "قَالَ قَآئِلٌۭ مِّنْهُمْ لَا تَقْتُلُوا۟ يُوسُفَ وَأَلْقُوهُ فِى غَيَٰبَتِ ٱلْجُبِّ يَلْتَقِطْهُ بَعْضُ ٱلسَّيَّارَةِ إِن كُنتُمْ فَٰعِلِينَ",
      "grade": "",
      "graded_by": ""
    },
    {
      "type": "ayah",
      "ref": "12:11",
      "text": "قَالُوا۟ يَٰٓأَبَانَا مَا لَكَ لَا تَأْمَ۫نَّا عَلَىٰ يُوسُفَ وَإِنَّا لَهُۥ لَنَٰصِحُونَ",
      "grade": "",
      "graded_by": ""
    },
    {
      "type": "ayah",
      "ref": "12:22",
      "text": "وَلَمَّا بَلَغَ أَشُدَّهُۥٓ ءَاتَيْنَٰهُ حُكْمًۭا وَعِلْمًۭا ۚ وَكَذَٰلِكَ نَجْزِى ٱلْمُحْسِنِينَ",
      "grade": "",
      "graded_by": ""
    },
    {
      "type": "ayah",
      "ref": "12:23",
      "text": "وَرَٰوَدَتْهُ ٱلَّتِى هُوَ فِى بَيْتِهَا عَن نَّفْسِهِۦ وَغَلَّقَتِ ٱلْأَبْوَٰبَ وَقَالَتْ هَيْتَ لَكَ ۚ قَالَ مَعَاذَ ٱللَّهِ ۖ إِنَّهُۥ رَبِّىٓ أَحْسَنَ مَثْوَاىَ ۖ إِنَّهُۥ لَا يُفْلِحُ ٱلظَّٰلِمُونَ",
      "grade": "",
      "graded_by": ""
    },
    {
      "type": "ayah",
      "ref": "12:24",
      "text": "وَلَقَدْ هَمَّتْ بِهِۦ ۖ وَهَمَّ بِهَا لَوْلَآ أَن رَّءَا بُرْهَٰنَ رَبِّهِۦ ۚ كَذَٰلِكَ لِنَصْرِفَ عَنْهُ ٱلسُّوٓءَ وَٱلْفَحْشَآءَ ۚ إِنَّهُۥ مِنْ عِبَادِنَا ٱلْمُخْلَصِينَ",
      "grade": "",
      "graded_by": ""
    },
    {
      "type": "ayah",
      "ref": "12:25",
      "text": "وَٱسْتَبَقَا ٱلْبَابَ وَقَدَّتْ قَمِيصَهُۥ مِن دُبُرٍۢ وَأَلْفَيَا سَيِّدَهَا لَدَا ٱلْبَابِ ۚ قَالَتْ مَا جَزَآءُ مَنْ أَرَادَ بِأَهْلِكَ سُوٓءًا إِلَّآ أَن يُسْجَنَ أَوْ عَذَابٌ أَلِيمٌۭ",
      "grade": "",
      "graded_by": ""
    },
    {
      "type": "ayah",
      "ref": "12:26",
      "text": "قَالَ هِىَ رَٰوَدَتْنِى عَن نَّفْسِى ۚ وَشَهِدَ شَاهِدٌۭ مِّنْ أَهْلِهَآ إِن كَانَ قَمِيصُهُۥ قُدَّ مِن قُبُلٍۢ فَصَدَقَتْ وَهُوَ مِنَ ٱلْكَٰذِبِينَ",
      "grade": "",
      "graded_by": ""
    },
    {
      "type": "ayah",
      "ref": "12:27",
      "text": "وَإِن كَانَ قَمِيصُهُۥ قُدَّ مِن دُبُرٍۢ فَكَذَبَتْ وَهُوَ مِنَ ٱلصَّٰدِقِينَ",
      "grade": "",
      "graded_by": ""
    },
    {
      "type": "ayah",
      "ref": "12:28",
      "text": "فَلَمَّا رَءَا قَمِيصَهُۥ قُدَّ مِن دُبُرٍۢ قَالَ إِنَّهُۥ مِن كَيْدِكُنَّ ۖ إِنَّ كَيْدَكُنَّ عَظِيمٌۭ",
      "grade": "",
      "graded_by": ""
    }
  ],
  "sources": [
    {
      "book": "القرآن الكريم برسم العثماني",
      "author": "مصحف المشروع المحلي",
      "locator": "public/data/quran"
    },
    {
      "book": "قصص الأنبياء",
      "author": "ابن كثير",
      "locator": "مختصر معتمد — دون إسرائيليات مخالفة"
    },
    {
      "book": "جامع البيان",
      "author": "الطبري",
      "locator": "مختصر مواضع الذكر"
    }
  ],
  "tags": [
    "أنبياء",
    "yusuf"
  ],
  "related": [
    "person-yusuf",
    "quiz-prophet-yusuf-1"
  ],
  "review_status": "verified",
  "updated_at": "2026-08-13",
  "section": "prophets",
  "meta": {
    "slug": "yusuf",
    "nation_id": null
  }
}
