{
  "id": "prophet-ismail",
  "title": "إسماعيل عليه السلام",
  "body": "## التعريف والنسب\nنبيٌّ صادق الوعد، كان يأمر أهله بالصلاة والزكاة، وشارك أباه في رفع قواعد البيت، وهو الذبيح على القول الراجح عند كثير من أهل العلم.\nيُقتصر في النسب والأخبار الزائدة على ما ثبت في الكتاب والسنة الصحيحة، ويُجتنب الجزم بما اختلف فيه أو جاء من طريق الإسرائيليات المخالفة. منهج العرض هنا: سوقُ النص القرآني أولاً، ثم بيانٌ مختصر على فهم السلف، مع الإحالة إلى قصص الأنبياء لابن كثير وتفسير الطبري وابن كثير والبغوي والسعدي عند التوسع.\n\n## الزمان والمكان\nلم يحدّد القرآن لكثير من الأنبياء تواريخ عددية دقيقة بالميلاد؛ فيُذكر ترتيبهم النسبي كما يدلّ عليه السياق القرآني دون اختراع تواريخ. وما جاء من تحديد بلدان أو أعمار بطرق ضعيفة أو إسرائيلية يُصنَّف ولا يُجزم به.\n\n## الدعوة\nأصل دعوة الرسل جميعاً التوحيد وعبادة الله وحده، ونهي أقوامهم عن الشرك والمعاصي، كما دلّت عليه مواضع قصصهم في القرآن. فالرسالة واحدة في الأصل، والشرائع قد تختلف بأمر الله.\n\n## أبرز المواقف والآيات\n﴿وَإِذْ جَعَلْنَا ٱلْبَيْتَ مَثَابَةًۭ لِّلنَّاسِ وَأَمْنًۭا وَٱتَّخِذُوا۟ مِن مَّقَامِ إِبْرَٰهِۦمَ مُصَلًّۭى ۖ وَعَهِدْنَآ إِلَىٰٓ إِبْرَٰهِۦمَ وَإِسْمَٰعِيلَ أَن طَهِّرَا بَيْتِىَ لِلطَّآئِفِينَ وَٱلْعَٰكِفِينَ وَٱلرُّكَّعِ ٱلسُّجُودِ﴾ [2:125]\n\n﴿وَإِذْ قَالَ إِبْرَٰهِۦمُ رَبِّ ٱجْعَلْ هَٰذَا بَلَدًا ءَامِنًۭا وَٱرْزُقْ أَهْلَهُۥ مِنَ ٱلثَّمَرَٰتِ مَنْ ءَامَنَ مِنْهُم بِٱللَّهِ وَٱلْيَوْمِ ٱلْءَاخِرِ ۖ قَالَ وَمَن كَفَرَ فَأُمَتِّعُهُۥ قَلِيلًۭا ثُمَّ أَضْطَرُّهُۥٓ إِلَىٰ عَذَابِ ٱلنَّارِ ۖ وَبِئْسَ ٱلْمَصِيرُ﴾ [2:126]\n\n﴿وَإِذْ يَرْفَعُ إِبْرَٰهِۦمُ ٱلْقَوَاعِدَ مِنَ ٱلْبَيْتِ وَإِسْمَٰعِيلُ رَبَّنَا تَقَبَّلْ مِنَّآ ۖ إِنَّكَ أَنتَ ٱلسَّمِيعُ ٱلْعَلِيمُ﴾ [2:127]\n\n﴿رَبَّنَا وَٱجْعَلْنَا مُسْلِمَيْنِ لَكَ وَمِن ذُرِّيَّتِنَآ أُمَّةًۭ مُّسْلِمَةًۭ لَّكَ وَأَرِنَا مَنَاسِكَنَا وَتُبْ عَلَيْنَآ ۖ إِنَّكَ أَنتَ ٱلتَّوَّابُ ٱلرَّحِيمُ﴾ [2:128]\n\n﴿رَبَّنَا وَٱبْعَثْ فِيهِمْ رَسُولًۭا مِّنْهُمْ يَتْلُوا۟ عَلَيْهِمْ ءَايَٰتِكَ وَيُعَلِّمُهُمُ ٱلْكِتَٰبَ وَٱلْحِكْمَةَ وَيُزَكِّيهِمْ ۚ إِنَّكَ أَنتَ ٱلْعَزِيزُ ٱلْحَكِيمُ﴾ [2:129]\n\n﴿وَٱذْكُرْ فِى ٱلْكِتَٰبِ إِسْمَٰعِيلَ ۚ إِنَّهُۥ كَانَ صَادِقَ ٱلْوَعْدِ وَكَانَ رَسُولًۭا نَّبِيًّۭا﴾ [19:54]\n\n﴿وَكَانَ يَأْمُرُ أَهْلَهُۥ بِٱلصَّلَوٰةِ وَٱلزَّكَوٰةِ وَكَانَ عِندَ رَبِّهِۦ مَرْضِيًّۭا﴾ [19:55]\n\n﴿رَبِّ هَبْ لِى مِنَ ٱلصَّٰلِحِينَ﴾ [37:100]\n\n﴿فَبَشَّرْنَٰهُ بِغُلَٰمٍ حَلِيمٍۢ﴾ [37:101]\n\n﴿فَلَمَّا بَلَغَ مَعَهُ ٱلسَّعْىَ قَالَ يَٰبُنَىَّ إِنِّىٓ أَرَىٰ فِى ٱلْمَنَامِ أَنِّىٓ أَذْبَحُكَ فَٱنظُرْ مَاذَا تَرَىٰ ۚ قَالَ يَٰٓأَبَتِ ٱفْعَلْ مَا تُؤْمَرُ ۖ سَتَجِدُنِىٓ إِن شَآءَ ٱللَّهُ مِنَ ٱلصَّٰبِرِينَ﴾ [37:102]\n\n﴿فَلَمَّآ أَسْلَمَا وَتَلَّهُۥ لِلْجَبِينِ﴾ [37:103]\n\n﴿وَنَٰدَيْنَٰهُ أَن يَٰٓإِبْرَٰهِيمُ﴾ [37:104]\n\n﴿قَدْ صَدَّقْتَ ٱلرُّءْيَآ ۚ إِنَّا كَذَٰلِكَ نَجْزِى ٱلْمُحْسِنِينَ﴾ [37:105]\n\n﴿إِنَّ هَٰذَا لَهُوَ ٱلْبَلَٰٓؤُا۟ ٱلْمُبِينُ﴾ [37:106]\n\n﴿وَفَدَيْنَٰهُ بِذِبْحٍ عَظِيمٍۢ﴾ [37:107]\n\n## الابتلاءات والمعجزات الثابتة\nما ثبت من آياتهم هو ما نصّ عليه القرآن أو صحّ من السنة؛ وما سواه إن ذُكر فبصيغة التوقف أو التصنيف لا الجزم. ولا تُروى المعجزات من القصص الواهية لإثارة العجب.\n\n## مآل قومه\nلم يرتبط في هذا المدخل بأمة مهلَكة مسمّاة، أو أن قومه داخلون في سياق أوسع يُفهم من مجموع الآيات.\n\n## الدروس والعبر\nبرّ الوالدين، والصدق، وإقامة الصلاة في الأهل.\nومن الفقه أن تُقرأ القصة لتعظيم الله وتحقيق التوحيد والصبر، لا للجدل بما لا ينفع.\n\n## سياسة المجلس في الإسرائيليات\nما خالف الشرع يُحذف، وما سُكت عنه يُعرض —إن احتيج— معلَّماً بأنه مسكوت عنه، ولا يُبنى عليه اعتقاد.",
  "evidences": [
    {
      "type": "ayah",
      "ref": "2:125",
      "text": "وَإِذْ جَعَلْنَا ٱلْبَيْتَ مَثَابَةًۭ لِّلنَّاسِ وَأَمْنًۭا وَٱتَّخِذُوا۟ مِن مَّقَامِ إِبْرَٰهِۦمَ مُصَلًّۭى ۖ وَعَهِدْنَآ إِلَىٰٓ إِبْرَٰهِۦمَ وَإِسْمَٰعِيلَ أَن طَهِّرَا بَيْتِىَ لِلطَّآئِفِينَ وَٱلْعَٰكِفِينَ وَٱلرُّكَّعِ ٱلسُّجُودِ",
      "grade": "",
      "graded_by": ""
    },
    {
      "type": "ayah",
      "ref": "2:126",
      "text": "وَإِذْ قَالَ إِبْرَٰهِۦمُ رَبِّ ٱجْعَلْ هَٰذَا بَلَدًا ءَامِنًۭا وَٱرْزُقْ أَهْلَهُۥ مِنَ ٱلثَّمَرَٰتِ مَنْ ءَامَنَ مِنْهُم بِٱللَّهِ وَٱلْيَوْمِ ٱلْءَاخِرِ ۖ قَالَ وَمَن كَفَرَ فَأُمَتِّعُهُۥ قَلِيلًۭا ثُمَّ أَضْطَرُّهُۥٓ إِلَىٰ عَذَابِ ٱلنَّارِ ۖ وَبِئْسَ ٱلْمَصِيرُ",
      "grade": "",
      "graded_by": ""
    },
    {
      "type": "ayah",
      "ref": "2:127",
      "text": "وَإِذْ يَرْفَعُ إِبْرَٰهِۦمُ ٱلْقَوَاعِدَ مِنَ ٱلْبَيْتِ وَإِسْمَٰعِيلُ رَبَّنَا تَقَبَّلْ مِنَّآ ۖ إِنَّكَ أَنتَ ٱلسَّمِيعُ ٱلْعَلِيمُ",
      "grade": "",
      "graded_by": ""
    },
    {
      "type": "ayah",
      "ref": "2:128",
      "text": "رَبَّنَا وَٱجْعَلْنَا مُسْلِمَيْنِ لَكَ وَمِن ذُرِّيَّتِنَآ أُمَّةًۭ مُّسْلِمَةًۭ لَّكَ وَأَرِنَا مَنَاسِكَنَا وَتُبْ عَلَيْنَآ ۖ إِنَّكَ أَنتَ ٱلتَّوَّابُ ٱلرَّحِيمُ",
      "grade": "",
      "graded_by": ""
    },
    {
      "type": "ayah",
      "ref": "2:129",
      "text": "رَبَّنَا وَٱبْعَثْ فِيهِمْ رَسُولًۭا مِّنْهُمْ يَتْلُوا۟ عَلَيْهِمْ ءَايَٰتِكَ وَيُعَلِّمُهُمُ ٱلْكِتَٰبَ وَٱلْحِكْمَةَ وَيُزَكِّيهِمْ ۚ إِنَّكَ أَنتَ ٱلْعَزِيزُ ٱلْحَكِيمُ",
      "grade": "",
      "graded_by": ""
    },
    {
      "type": "ayah",
      "ref": "19:54",
      "text": "وَٱذْكُرْ فِى ٱلْكِتَٰبِ إِسْمَٰعِيلَ ۚ إِنَّهُۥ كَانَ صَادِقَ ٱلْوَعْدِ وَكَانَ رَسُولًۭا نَّبِيًّۭا",
      "grade": "",
      "graded_by": ""
    },
    {
      "type": "ayah",
      "ref": "19:55",
      "text": "وَكَانَ يَأْمُرُ أَهْلَهُۥ بِٱلصَّلَوٰةِ وَٱلزَّكَوٰةِ وَكَانَ عِندَ رَبِّهِۦ مَرْضِيًّۭا",
      "grade": "",
      "graded_by": ""
    },
    {
      "type": "ayah",
      "ref": "37:100",
      "text": "رَبِّ هَبْ لِى مِنَ ٱلصَّٰلِحِينَ",
      "grade": "",
      "graded_by": ""
    },
    {
      "type": "ayah",
      "ref": "37:101",
      "text": "فَبَشَّرْنَٰهُ بِغُلَٰمٍ حَلِيمٍۢ",
      "grade": "",
      "graded_by": ""
    },
    {
      "type": "ayah",
      "ref": "37:102",
      "text": "فَلَمَّا بَلَغَ مَعَهُ ٱلسَّعْىَ قَالَ يَٰبُنَىَّ إِنِّىٓ أَرَىٰ فِى ٱلْمَنَامِ أَنِّىٓ أَذْبَحُكَ فَٱنظُرْ مَاذَا تَرَىٰ ۚ قَالَ يَٰٓأَبَتِ ٱفْعَلْ مَا تُؤْمَرُ ۖ سَتَجِدُنِىٓ إِن شَآءَ ٱللَّهُ مِنَ ٱلصَّٰبِرِينَ",
      "grade": "",
      "graded_by": ""
    },
    {
      "type": "ayah",
      "ref": "37:103",
      "text": "فَلَمَّآ أَسْلَمَا وَتَلَّهُۥ لِلْجَبِينِ",
      "grade": "",
      "graded_by": ""
    },
    {
      "type": "ayah",
      "ref": "37:104",
      "text": "وَنَٰدَيْنَٰهُ أَن يَٰٓإِبْرَٰهِيمُ",
      "grade": "",
      "graded_by": ""
    },
    {
      "type": "ayah",
      "ref": "37:105",
      "text": "قَدْ صَدَّقْتَ ٱلرُّءْيَآ ۚ إِنَّا كَذَٰلِكَ نَجْزِى ٱلْمُحْسِنِينَ",
      "grade": "",
      "graded_by": ""
    },
    {
      "type": "ayah",
      "ref": "37:106",
      "text": "إِنَّ هَٰذَا لَهُوَ ٱلْبَلَٰٓؤُا۟ ٱلْمُبِينُ",
      "grade": "",
      "graded_by": ""
    },
    {
      "type": "ayah",
      "ref": "37:107",
      "text": "وَفَدَيْنَٰهُ بِذِبْحٍ عَظِيمٍۢ",
      "grade": "",
      "graded_by": ""
    }
  ],
  "sources": [
    {
      "book": "القرآن الكريم برسم العثماني",
      "author": "مصحف المشروع المحلي",
      "locator": "public/data/quran"
    },
    {
      "book": "قصص الأنبياء",
      "author": "ابن كثير",
      "locator": "مختصر معتمد — دون إسرائيليات مخالفة"
    },
    {
      "book": "جامع البيان",
      "author": "الطبري",
      "locator": "مختصر مواضع الذكر"
    }
  ],
  "tags": [
    "أنبياء",
    "ismail"
  ],
  "related": [
    "person-ismail",
    "quiz-prophet-ismail-1"
  ],
  "review_status": "verified",
  "updated_at": "2026-08-13",
  "section": "prophets",
  "meta": {
    "slug": "ismail",
    "nation_id": null
  }
}
