{
  "id": "prophet-ayyub",
  "title": "أيوب عليه السلام",
  "body": "## التعريف والنسب\nأيوب عليه السلام — عبد الله الصابر.\nأيوب عليه السلام نبيٌّ مذكور في القرآن. يُقتصر في النسب والأخبار الزائدة على ما ثبت في الكتاب والسنة الصحيحة. وما جاء من الإسرائيليات مما خالف الشرع يُطرح، وما سُكت عنه لا يُجزم به. منهج العرض: النص أولاً ثم بيان مختصر على فهم السلف، مع الإحالة إلى قصص الأنبياء لابن كثير وتفاسير الطبري وابن كثير والبغوي والسعدي. لم يحدّد القرآن لكثير من الأنبياء تواريخ عددية دقيقة بالميلاد؛ فيُذكر ترتيبهم النسبي كما يدلّ عليه السياق دون اختراع تواريخ.\nيُقتصر على ما ثبت في الكتاب والسنة الصحيحة؛ وما خالف الشرع من الإسرائيليات يُطرح، وما سُكت عنه لا يُجزم به.\n\n## الزمان والمكان\nالعصر/الترتيب النسبي: غير محدد بنص صحيح صريح — لم يثبت تحديد مكانه أو زمنه بنص صحيح صريح.\nالقوم أو الموضع كما في العرض المعتمد: غير محدد بنص صحيح صريح.\nلا تُخترع تواريخ عددية لم يحدّدها الوحي؛ العمدة سياق القرآن وصحيح السنة.\n\n## أصل الدعوة\nأصل دعوة الرسل جميعاً التوحيد وعبادة الله وحده، ونهي أقوامهم عن الشرك والمعاصي. قال الله في سياق الرسل ما يدل على وحدة هذا الأصل. فقراءة قصة أيوب عليه السلام تُرجع القلب إلى إفراد الله بالعبادة قبل الاشتغال بتفاصيل الأخبار.\n\n## الآيات الواردة في قصته\nفيما يلي طائفة من الآيات المرتبطة بـأيوب عليه السلام كما في المصحف المحلي (رسم عثماني). تُقرأ في سياقها دون بتر مخلّ:\n\n﴿۞ وَأَيُّوبَ إِذْ نَادَىٰ رَبَّهُۥٓ أَنِّى مَسَّنِىَ ٱلضُّرُّ وَأَنتَ أَرْحَمُ ٱلرَّٰحِمِينَ﴾ [21:83]\n\n﴿فَٱسْتَجَبْنَا لَهُۥ فَكَشَفْنَا مَا بِهِۦ مِن ضُرٍّۢ ۖ وَءَاتَيْنَٰهُ أَهْلَهُۥ وَمِثْلَهُم مَّعَهُمْ رَحْمَةًۭ مِّنْ عِندِنَا وَذِكْرَىٰ لِلْعَٰبِدِينَ﴾ [21:84]\n\n﴿وَٱذْكُرْ عَبْدَنَآ أَيُّوبَ إِذْ نَادَىٰ رَبَّهُۥٓ أَنِّى مَسَّنِىَ ٱلشَّيْطَٰنُ بِنُصْبٍۢ وَعَذَابٍ﴾ [38:41]\n\n﴿ٱرْكُضْ بِرِجْلِكَ ۖ هَٰذَا مُغْتَسَلٌۢ بَارِدٌۭ وَشَرَابٌۭ﴾ [38:42]\n\n﴿وَوَهَبْنَا لَهُۥٓ أَهْلَهُۥ وَمِثْلَهُم مَّعَهُمْ رَحْمَةًۭ مِّنَّا وَذِكْرَىٰ لِأُو۟لِى ٱلْأَلْبَٰبِ﴾ [38:43]\n\n﴿وَخُذْ بِيَدِكَ ضِغْثًۭا فَٱضْرِب بِّهِۦ وَلَا تَحْنَثْ ۗ إِنَّا وَجَدْنَٰهُ صَابِرًۭا ۚ نِّعْمَ ٱلْعَبْدُ ۖ إِنَّهُۥٓ أَوَّابٌۭ﴾ [38:44]\n\n﴿۞ إِنَّآ أَوْحَيْنَآ إِلَيْكَ كَمَآ أَوْحَيْنَآ إِلَىٰ نُوحٍۢ وَٱلنَّبِيِّۦنَ مِنۢ بَعْدِهِۦ ۚ وَأَوْحَيْنَآ إِلَىٰٓ إِبْرَٰهِيمَ وَإِسْمَٰعِيلَ وَإِسْحَٰقَ وَيَعْقُوبَ وَٱلْأَسْبَاطِ وَعِيسَىٰ وَأَيُّوبَ وَيُونُسَ وَهَٰرُونَ وَسُلَيْمَٰنَ ۚ وَءَاتَيْنَا دَاوُۥدَ زَبُورًۭا﴾ [4:163]\n\n## أبرز المواقف والابتلاءات\n- ضرب المثل في الصبر.\n- كانت شكواه إلى الله لا اعتراضًا على قضائه.\n- الفرج بعد الشدة من عند الله.\n\n## المعجزات والآيات البينات\nالمعجزة ما أيّد الله به نبيّه على وجه يعجز عنه الخلق. لا تُروى المعجزات من القصص الواهية. وما ثبت لـأيوب عليه السلام يُطلب من مواضع الآيات أعلاه ومن صحيح السنة إن وُجد، مع ذكر التخريج والدرجة عند إيراد الحديث.\n\n## مآل قومه والعبرة العامة\nإن ارتبط بقوم مكذّبين فمآلهم عبرة لمن بعدهم؛ والمقصود من ذكره تثبيت التوحيد والصبر. لا يُكرَّر هنا نص مقالة الأمة كاملة إن وُجدت في related.\n\n## الدروس والعبر\n1) الصبر على البلاء طريق إلى الفرج.\n2) الشكوى إلى الله عبادة لا تنافي الصبر.\n3) الثبات على التوحيد في أشد المحن.\n4) ذكر الله في البلاء كما في الرخاء.\n\n## سياسة سُنّة في الإسرائيليات والتوسع\nما خالف الشرع يُحذف. وما سُكت عنه إن ذُكر يُعلَّم أنه مسكوت عنه. ولا تُبنى عقيدة على خبر لم يثبت. وعند الحاجة للتوسع يُرجع لكتب التفسير المعتمدة مع نسبة كل قول لقائله.\n\n## خاتمة منهجية\nقراءة سيرة أيوب عليه السلام طريق إلى معرفة الله وتعظيم رسله، لا إلى الاستكثار من الغرائب. فليقرأ القارئ الآيات، وليتدبّر، وليسأل أهل العلم عند الإشكال، وليحذر من المصادر المختلطة التي تخلط الصحيح بالضعيف بلا تمييز.\n\n### ملاحظة منهجية\nيُقدَّم القرآن ثم الصحيح من السنة، ويُؤخَّر كلام المؤرخين، ويُميَّز بين العقيدة القطعية والخبر التاريخي.\n\n## تثبيت منهجي\nيُقتصر على ما دلّ عليه القرآن وصحيح السنة، مع ترك الإسرائيليات والتفاصيل التي لم يثبت سندها.\n",
  "evidences": [
    {
      "type": "ayah",
      "ref": "21:83",
      "text": "۞ وَأَيُّوبَ إِذْ نَادَىٰ رَبَّهُۥٓ أَنِّى مَسَّنِىَ ٱلضُّرُّ وَأَنتَ أَرْحَمُ ٱلرَّٰحِمِينَ",
      "grade": "",
      "graded_by": ""
    },
    {
      "type": "ayah",
      "ref": "21:84",
      "text": "فَٱسْتَجَبْنَا لَهُۥ فَكَشَفْنَا مَا بِهِۦ مِن ضُرٍّۢ ۖ وَءَاتَيْنَٰهُ أَهْلَهُۥ وَمِثْلَهُم مَّعَهُمْ رَحْمَةًۭ مِّنْ عِندِنَا وَذِكْرَىٰ لِلْعَٰبِدِينَ",
      "grade": "",
      "graded_by": ""
    },
    {
      "type": "ayah",
      "ref": "38:41",
      "text": "وَٱذْكُرْ عَبْدَنَآ أَيُّوبَ إِذْ نَادَىٰ رَبَّهُۥٓ أَنِّى مَسَّنِىَ ٱلشَّيْطَٰنُ بِنُصْبٍۢ وَعَذَابٍ",
      "grade": "",
      "graded_by": ""
    },
    {
      "type": "ayah",
      "ref": "38:42",
      "text": "ٱرْكُضْ بِرِجْلِكَ ۖ هَٰذَا مُغْتَسَلٌۢ بَارِدٌۭ وَشَرَابٌۭ",
      "grade": "",
      "graded_by": ""
    },
    {
      "type": "ayah",
      "ref": "38:43",
      "text": "وَوَهَبْنَا لَهُۥٓ أَهْلَهُۥ وَمِثْلَهُم مَّعَهُمْ رَحْمَةًۭ مِّنَّا وَذِكْرَىٰ لِأُو۟لِى ٱلْأَلْبَٰبِ",
      "grade": "",
      "graded_by": ""
    },
    {
      "type": "ayah",
      "ref": "38:44",
      "text": "وَخُذْ بِيَدِكَ ضِغْثًۭا فَٱضْرِب بِّهِۦ وَلَا تَحْنَثْ ۗ إِنَّا وَجَدْنَٰهُ صَابِرًۭا ۚ نِّعْمَ ٱلْعَبْدُ ۖ إِنَّهُۥٓ أَوَّابٌۭ",
      "grade": "",
      "graded_by": ""
    },
    {
      "type": "ayah",
      "ref": "4:163",
      "text": "۞ إِنَّآ أَوْحَيْنَآ إِلَيْكَ كَمَآ أَوْحَيْنَآ إِلَىٰ نُوحٍۢ وَٱلنَّبِيِّۦنَ مِنۢ بَعْدِهِۦ ۚ وَأَوْحَيْنَآ إِلَىٰٓ إِبْرَٰهِيمَ وَإِسْمَٰعِيلَ وَإِسْحَٰقَ وَيَعْقُوبَ وَٱلْأَسْبَاطِ وَعِيسَىٰ وَأَيُّوبَ وَيُونُسَ وَهَٰرُونَ وَسُلَيْمَٰنَ ۚ وَءَاتَيْنَا دَاوُۥدَ زَبُورًۭا",
      "grade": "",
      "graded_by": ""
    }
  ],
  "sources": [
    {
      "book": "القرآن الكريم برسم العثماني",
      "author": "مصحف المشروع المحلي",
      "locator": "public/data/quran"
    },
    {
      "book": "قصص الأنبياء",
      "author": "ابن كثير",
      "locator": "مختصر معتمد — دون إسرائيليات مخالفة"
    },
    {
      "book": "جامع البيان",
      "author": "الطبري",
      "locator": "مختصر مواضع الذكر"
    },
    {
      "book": "بيانات الأنبياء في المنصة",
      "author": "سُنّة",
      "locator": "src/lib/prophets-data.ts"
    }
  ],
  "tags": [
    "أنبياء",
    "ayyub",
    "موسّع"
  ],
  "related": [
    "person-ayyub",
    "quiz-prophet-ayyub-1"
  ],
  "review_status": "verified",
  "updated_at": "2026-09-02",
  "section": "prophets",
  "meta": {
    "slug": "ayyub",
    "nation_id": null
  }
}
