{
  "id": "nation-rum-furs",
  "title": "الروم والفرس عند البعثة",
  "body": "## التعريف\nالروم والفرس عند البعثة (يُعرف أيضاً: الروم، فارس، غَلَبَتِ الرُّوم).\nأخبر القرآن أن الروم غُلبوا ثم سيغلبون في بضع سنين، وأن يومئذ يفرح المؤمنون بنصر الله. الآية خبر غيب تحقق، وليست قصة أمة مهلَكة؛ فيُعرض السياق كما هو دون تحميل سياسي زائد.\nلم يُسمَّ في العرض نبيّ بعينه لكل تفاصيل هذه المجموعة؛ العمدة ما نصّ عليه القرآن.\n\n## سياق الذكر في القرآن\nالمكان كما في العرض المعتمد: بلاد الروم وفارس كما يدل سياق السورة.\nالحقبة/الترتيب النسبي: عند بعثة النبي ﷺ.\nذُكروا في القرآن للعبرة وتحذير الأمم، لا للاستكثار من الغرائب التي لم يثبتها الوحي.\n\n## الذنب والموقف\nالذنب أو سبب العقوبة: ليست قصة عذاب لأمة؛ بل إخبار بغيب في سورة الروم.\nموقفهم من الدعوة: هزيمة الروم ثم غلبتهم كما أخبر القرآن.\nأبرز أحوالهم:\n- صراع بين دولتين عظميين\n- خبر قرآني بغيب تحقق\n- فرح المؤمنين بوعد الله\n\n## الآيات الواردة\nطائفة من الآيات المرتبطة بـالروم والفرس عند البعثة من المصحف المحلي (رسم عثماني):\n\n﴿بِسْمِ ٱللَّهِ ٱلرَّحْمَٰنِ ٱلرَّحِيمِ الٓمٓ﴾ [30:1]\n\n﴿غُلِبَتِ ٱلرُّومُ﴾ [30:2]\n\n﴿فِىٓ أَدْنَى ٱلْأَرْضِ وَهُم مِّنۢ بَعْدِ غَلَبِهِمْ سَيَغْلِبُونَ﴾ [30:3]\n\n﴿فِى بِضْعِ سِنِينَ ۗ لِلَّهِ ٱلْأَمْرُ مِن قَبْلُ وَمِنۢ بَعْدُ ۚ وَيَوْمَئِذٍۢ يَفْرَحُ ٱلْمُؤْمِنُونَ﴾ [30:4]\n\n﴿بِنَصْرِ ٱللَّهِ ۚ يَنصُرُ مَن يَشَآءُ ۖ وَهُوَ ٱلْعَزِيزُ ٱلرَّحِيمُ﴾ [30:5]\n\n﴿وَعْدَ ٱللَّهِ ۖ لَا يُخْلِفُ ٱللَّهُ وَعْدَهُۥ وَلَٰكِنَّ أَكْثَرَ ٱلنَّاسِ لَا يَعْلَمُونَ﴾ [30:6]\n\n﴿يَعْلَمُونَ ظَٰهِرًۭا مِّنَ ٱلْحَيَوٰةِ ٱلدُّنْيَا وَهُمْ عَنِ ٱلْءَاخِرَةِ هُمْ غَٰفِلُونَ﴾ [30:7]\n\n## المآل والعبرة\nالعقوبة: غير مفصل — لا عقوبة في السياق؛ إنما وعدٌ بغلبة الروم بعد هزيمتهم.\nالناجون: المؤمنون الذين فرحوا بنصر الله وصدق وعده.\nالعبر:\n1) صدق خبر القرآن في الغيب يقوّي اليقين.\n2) فرح المؤمن بما يُظهر الله من آياته لا بما يوافق هواه السياسي.\n3) لا تُحمَّل الآيات ما لا تحتمله من تفاصيل السياسة المعاصرة.\n\nماذا نتعلم اليوم؟\n- ثق بوعد الله ولو خالفت ظواهر القوة.\n- افرح بما يُظهر صدق الوحي لا بما يوافق ميلك.\n\n## سياسة الإسرائيليات\nما خالف الشرع يُحذف. وما سُكت عنه إن ذُكر يُعلَّم أنه مسكوت عنه. ولا تُبنى عقيدة على خبر لم يثبت من كتاب أو سنة صحيحة.\n\n## خاتمة منهجية\nقراءة خبر «الروم والفرس عند البعثة» طريق إلى تعظيم التوحيد والحذر من الاستكبار، لا إلى الاستكثار من الغرائب.\n\n## العبرة من صراع الدولتين\nذكر القرآن تقلّب الروم وفارس للعبرة في أنّ الغلبة الدنيوية لا تدوم، وأنّ الوعد الإلهي يصدق. لا يُجعل التاريخ بديلًا عن الإيمان بالغيب.\n\n## تثبيت منهجي\nيُقتصر على ما دلّ عليه القرآن وصحيح السنة وما حرّره أهل التفسير المعتمدون، مع اجتناب الإسرائيليات المخالفة. وما سكت عنه الوحي لا يُجزم بتفصيله.\n\n## عبرة للمكلّف\nالعبرة من قصص الأمم: التوحيد، والتحذير من التكذيب، والصبر على الحق، لا الاستكثار من الغرائب.\n\n## شواهد من القرآن\n\n- **30:1**: بِسْمِ ٱللَّهِ ٱلرَّحْمَٰنِ ٱلرَّحِيمِ الٓمٓ\n- **30:2**: غُلِبَتِ ٱلرُّومُ\n- **30:3**: فِىٓ أَدْنَى ٱلْأَرْضِ وَهُم مِّنۢ بَعْدِ غَلَبِهِمْ سَيَغْلِبُونَ\n- **30:4**: فِى بِضْعِ سِنِينَ ۗ لِلَّهِ ٱلْأَمْرُ مِن قَبْلُ وَمِنۢ بَعْدُ ۚ وَيَوْمَئِذٍۢ يَفْرَحُ ٱلْمُؤْمِنُونَ\n- **30:5**: بِنَصْرِ ٱللَّهِ ۚ يَنصُرُ مَن يَشَآءُ ۖ وَهُوَ ٱلْعَزِيزُ ٱلرَّحِيمُ\n- **30:6**: وَعْدَ ٱللَّهِ ۖ لَا يُخْلِفُ ٱللَّهُ وَعْدَهُۥ وَلَٰكِنَّ أَكْثَرَ ٱلنَّاسِ لَا يَعْلَمُونَ\n- **30:7**: يَعْلَمُونَ ظَٰهِرًۭا مِّنَ ٱلْحَيَوٰةِ ٱلدُّنْيَا وَهُمْ عَنِ ٱلْءَاخِرَةِ هُمْ غَٰفِلُونَ\n",
  "evidences": [
    {
      "type": "ayah",
      "ref": "30:1",
      "text": "بِسْمِ ٱللَّهِ ٱلرَّحْمَٰنِ ٱلرَّحِيمِ الٓمٓ",
      "grade": "",
      "graded_by": ""
    },
    {
      "type": "ayah",
      "ref": "30:2",
      "text": "غُلِبَتِ ٱلرُّومُ",
      "grade": "",
      "graded_by": ""
    },
    {
      "type": "ayah",
      "ref": "30:3",
      "text": "فِىٓ أَدْنَى ٱلْأَرْضِ وَهُم مِّنۢ بَعْدِ غَلَبِهِمْ سَيَغْلِبُونَ",
      "grade": "",
      "graded_by": ""
    },
    {
      "type": "ayah",
      "ref": "30:4",
      "text": "فِى بِضْعِ سِنِينَ ۗ لِلَّهِ ٱلْأَمْرُ مِن قَبْلُ وَمِنۢ بَعْدُ ۚ وَيَوْمَئِذٍۢ يَفْرَحُ ٱلْمُؤْمِنُونَ",
      "grade": "",
      "graded_by": ""
    },
    {
      "type": "ayah",
      "ref": "30:5",
      "text": "بِنَصْرِ ٱللَّهِ ۚ يَنصُرُ مَن يَشَآءُ ۖ وَهُوَ ٱلْعَزِيزُ ٱلرَّحِيمُ",
      "grade": "",
      "graded_by": ""
    },
    {
      "type": "ayah",
      "ref": "30:6",
      "text": "وَعْدَ ٱللَّهِ ۖ لَا يُخْلِفُ ٱللَّهُ وَعْدَهُۥ وَلَٰكِنَّ أَكْثَرَ ٱلنَّاسِ لَا يَعْلَمُونَ",
      "grade": "",
      "graded_by": ""
    },
    {
      "type": "ayah",
      "ref": "30:7",
      "text": "يَعْلَمُونَ ظَٰهِرًۭا مِّنَ ٱلْحَيَوٰةِ ٱلدُّنْيَا وَهُمْ عَنِ ٱلْءَاخِرَةِ هُمْ غَٰفِلُونَ",
      "grade": "",
      "graded_by": ""
    }
  ],
  "sources": [
    {
      "book": "القرآن الكريم برسم العثماني",
      "author": "مصحف المشروع المحلي",
      "locator": "public/data/quran"
    },
    {
      "book": "قصص الأنبياء",
      "author": "ابن كثير",
      "locator": "مختصر معتمد — دون إسرائيليات مخالفة"
    },
    {
      "book": "بذرة الأمم السابقة",
      "author": "سُنّة",
      "locator": "src/lib/nations-seed.ts"
    }
  ],
  "tags": [
    "أمم",
    "موسّع"
  ],
  "related": [
    "prophet-muhammad",
    "nation-bani-israil"
  ],
  "review_status": "verified",
  "updated_at": "2026-09-02",
  "section": "nations"
}
